{
  "cycle": 1,
  "input_plan": "docs/foo/plan.md",
  "started_at": "2026-06-02T00:00:00Z",
  "completed_at": "2026-06-02T00:10:00Z",
  "context7_available": false,
  "git_available": true,
  "backend": "teams",
  "docs_base": "documentation",
  "verification": {"mode": "per-wave", "waves_total": 1, "waves_verified": 1, "waves_skipped": 0},
  "dag": {
    "mode": "dag",
    "base_ref": "4a1b2c3d",
    "integration_branch": "plan-runner/cycle-1",
    "branch_owned": true,
    "events_path": "docs/plan-runner/2026-06-02/cycle-1/events.jsonl",
    "stop_reason": null,
    "final_verification": {
      "status": "passed",
      "artifacts": ["docs/plan-runner/2026-06-02/cycle-1/verification/final.json"],
      "completed_at": "2026-06-02T00:09:00Z"
    },
    "tasks": [
      {
        "task_id": "adder-tests",
        "required": true,
        "depends_on": [],
        "status": "integrated",
        "attempts": 1,
        "base_commit": "4a1b2c3d",
        "produced_commit": "5b2c3d4e",
        "integrated_commit": "6c3d4e5f",
        "verification_artifacts": ["docs/plan-runner/2026-06-02/cycle-1/verification/adder-tests.json"],
        "retry_evidence": [],
        "block_reason": null,
        "lifecycle_event_ids": ["event-001", "event-002"],
        "tokens": {"input": 12000, "output": 3400, "total": 15400, "source": "harness"}
      }
    ]
  },
  "waves": [
    {
      "wave_id": 1,
      "duration_seconds": 42,
      "agents": [
        {"agent_id": "wave-1-agent-1", "dev_status": "DONE", "verifier_status": "CLEAN", "bug_count": 0, "tokens": {"input": 12000, "output": 3400, "total": 15400, "source": "harness"}},
        {"agent_id": "wave-1-agent-2", "dev_status": "DONE", "verifier_status": "CLEAN", "bug_count": 0, "tokens": null}
      ],
      "verifier_tokens": {"input": null, "output": null, "total": 9200, "source": "self_report"},
      "wave_token_total": 24600,
      "commit_sha": "abc123",
      "skipped_reason": null
    }
  ],
  "total_bugs": 0,
  "token_usage": {
    "by_agent": [
      {"agent": "analyzer", "phase": "analyze", "input": 5000, "output": 900, "total": 5900, "source": "harness"},
      {"agent": "wave-1-agent-1", "phase": "wave", "input": 12000, "output": 3400, "total": 15400, "source": "harness"},
      {"agent": "wave-1-agent-2", "phase": "wave", "input": null, "output": null, "total": null},
      {"agent": "wave-1-verifier", "phase": "verify", "input": null, "output": null, "total": 9200, "source": "self_report"}
    ],
    "total_tokens": 30500,
    "agents_reported": 3,
    "agents_total": 4,
    "complete": false
  },
  "next_cycle_plan": null,
  "tdd": {
    "enabled": true,
    "test_command": {"full": "npm test", "single_file": "npm test -- {file}"},
    "baseline_failing": [],
    "tasks": [
      {
        "task": "implement adder",
        "test_files": ["tests/adder.test.js"],
        "red_run": {"cmd": "npm test -- tests/adder.test.js", "exit": 1, "result": "FAILED", "valid_red": true},
        "green_run": {"cmd": "npm test -- tests/adder.test.js", "exit": 0, "result": "PASSED", "valid_green": true}
      }
    ]
  }
}
