{
  "cycle": 1,
  "input_plan": "docs/foo/plan.md",
  "started_at": "2026-08-30T00:00:00Z",
  "completed_at": "2026-08-30T00:10:00Z",
  "context7_available": false,
  "waves": [
    {
      "wave_id": 1,
      "agents": [
        {
          "agent_id": "wave-1-agent-1",
          "dev_status": "DONE",
          "verifier_status": "CLEAN",
          "bug_count": 0,
          "resolved_model": "claude-sonnet-5",
          "model_substituted": null
        },
        {
          "agent_id": "wave-1-agent-2",
          "dev_status": "DONE",
          "verifier_status": "CLEAN",
          "bug_count": 0,
          "resolved_model": "claude-sonnet-5",
          "model_substituted": {
            "configured": "gpt-5-custom",
            "dispatched": "claude-sonnet-5",
            "reason": "configured model unavailable"
          }
        }
      ]
    }
  ],
  "total_bugs": 0
}
