{
  "cycle": 1,
  "input_plan": "docs/foo/plan.md",
  "started_at": "2026-09-01T00:00:00Z",
  "completed_at": "2026-09-01T00:10:00Z",
  "context7_available": false,
  "waves": [
    {
      "wave_id": 1,
      "agents": [
        {
          "agent_id": "wave-1-agent-1",
          "dev_status": "DONE",
          "verifier_status": "CLEAN",
          "bug_count": 0,
          "dispatch_mechanism": "endpoint",
          "tokens": {"input": 1200, "output": 340, "total": 1540, "source": "http_usage"}
        },
        {
          "agent_id": "wave-1-agent-2",
          "dev_status": "DONE",
          "verifier_status": "CLEAN",
          "bug_count": 0,
          "dispatch_mechanism": "host_subagent"
        }
      ]
    }
  ],
  "total_bugs": 0
}
